{
  "schema_version": "aegisbench-annotation-task-v1",
  "record_kind": "ANNOTATION_TASK_NOT_GROUND_TRUTH",
  "id": "GHSA-9rwj-6rc7-p77c-risk-affected",
  "type": "ASSET_RISK",
  "additional_types": [],
  "category": "risk",
  "question": "按 benchmark-reference-triage-v1 评估此演示资产对 CVE-2025-67644 的风险与优先级。",
  "input_context": {
    "asset": {
      "component": "langgraph-checkpoint-sqlite",
      "id": "demo-GHSA-9rwj-6rc7-p77c-affected",
      "scenario": "CONTROLLED_NOT_PRODUCTION",
      "version": "3.0.0"
    },
    "component": "langgraph-checkpoint-sqlite",
    "ecosystem": "PyPI",
    "target": "CVE-2025-67644",
    "triage_policy": "benchmark-reference-triage-v1"
  },
  "origin": "CONTROLLED_SCENARIO",
  "source_ids": [
    "GHSA-9rwj-6rc7-p77c"
  ],
  "dataset_version": "AegisBench-v0.2.1-pilot",
  "dataset_questions_sha256": "f1f4be86e202ec263c6ebac66782b74d265840d706b559d913ab0c8c5f45e6f1",
  "question_sha256": "86b5138af72adeb89233cdee03d490387c58861a39bd55a5a2c1284206b03c12",
  "batch_id": "batch_01",
  "batch_position": 9,
  "status": "DRAFT",
  "assignment_status": "UNASSIGNED",
  "annotator": "",
  "reviewer": "",
  "annotation_record_status": "NOT_STARTED",
  "annotation_record_path": null,
  "annotation_content_sha256": null,
  "evidence_count": 0,
  "candidate_evidence_count": 6,
  "candidate_packet_paths": [
    "../batches/batch_01/evidence_candidates/GHSA-9rwj-6rc7-p77c.json"
  ],
  "source_check_ids": [
    "database-GHSA-9rwj-6rc7-p77c",
    "maintainer-GHSA-9rwj-6rc7-p77c"
  ],
  "human_confirmations": {
    "annotator_read_sources": false,
    "reviewer_read_sources": false
  },
  "quality_gate": "AWAITING_HUMANS",
  "prepared_by": "AI_ASSISTANT",
  "prepared_at": "2026-10-11T08:42:32.891966+00:00",
  "history": [
    {
      "event": "TASK_CREATED_BY_AI",
      "actor": "AI_ASSISTANT",
      "at": "2026-10-11T08:42:32.891966+00:00",
      "note": "Question metadata copied verbatim; no answer, human identity, signature or approval generated."
    }
  ]
}
