{
  "schema_version": "aegisbench-annotation-task-v1",
  "record_kind": "ANNOTATION_TASK_NOT_GROUND_TRUTH",
  "id": "GHSA-935w-9g4m-p28p-multihop",
  "type": "MULTIHOP_QA",
  "additional_types": [],
  "category": "multihop",
  "question": "按 benchmark-reference-triage-v1 查询公告、比较版本并分析这两个演示资产，哪一个应优先处理？",
  "input_context": {
    "assets": [
      {
        "component": "vllm",
        "id": "demo-GHSA-935w-9g4m-p28p-affected",
        "scenario": "CONTROLLED_NOT_PRODUCTION",
        "version": "0.29.0"
      },
      {
        "component": "vllm",
        "id": "demo-GHSA-935w-9g4m-p28p-fixed",
        "scenario": "CONTROLLED_NOT_PRODUCTION",
        "version": "0.30.0"
      }
    ],
    "component": "vllm",
    "ecosystem": "PyPI",
    "target": "CVE-2026-105752",
    "triage_policy": "benchmark-reference-triage-v1"
  },
  "origin": "CONTROLLED_SCENARIO",
  "source_ids": [
    "GHSA-935w-9g4m-p28p"
  ],
  "dataset_version": "AegisBench-v0.2.1-pilot",
  "dataset_questions_sha256": "f1f4be86e202ec263c6ebac66782b74d265840d706b559d913ab0c8c5f45e6f1",
  "question_sha256": "68366e89d4468b9e354e4f19ad167bd25a8d1546685ab11d069aa6f79d6b6a01",
  "batch_id": "batch_03",
  "batch_position": 17,
  "status": "DRAFT",
  "assignment_status": "UNASSIGNED",
  "annotator": "",
  "reviewer": "",
  "annotation_record_status": "NOT_STARTED",
  "annotation_record_path": null,
  "annotation_content_sha256": null,
  "evidence_count": 0,
  "candidate_evidence_count": 0,
  "candidate_packet_paths": [],
  "source_check_ids": [],
  "human_confirmations": {
    "annotator_read_sources": false,
    "reviewer_read_sources": false
  },
  "quality_gate": "AWAITING_HUMANS",
  "prepared_by": "AI_ASSISTANT",
  "prepared_at": "2026-10-11T08:42:32.891966+00:00",
  "history": [
    {
      "event": "TASK_CREATED_BY_AI",
      "actor": "AI_ASSISTANT",
      "at": "2026-10-11T08:42:32.891966+00:00",
      "note": "Question metadata copied verbatim; no answer, human identity, signature or approval generated."
    }
  ]
}
