{
  "schema_version": "aegisbench-annotation-task-v1",
  "record_kind": "ANNOTATION_TASK_NOT_GROUND_TRUTH",
  "id": "GHSA-53q9-r3pm-6pq6-facts",
  "type": "VULNERABILITY_FACTS",
  "additional_types": [],
  "category": "facts",
  "question": "查询 CVE-2025-32434 的描述、CWE 和按版本区分的 CVSS。",
  "input_context": {
    "component": "torch",
    "ecosystem": "PyPI",
    "target": "CVE-2025-32434"
  },
  "origin": "REAL_SOURCE",
  "source_ids": [
    "GHSA-53q9-r3pm-6pq6"
  ],
  "dataset_version": "AegisBench-v0.2.1-pilot",
  "dataset_questions_sha256": "f1f4be86e202ec263c6ebac66782b74d265840d706b559d913ab0c8c5f45e6f1",
  "question_sha256": "e6dc332b0f06bf34cfa4a261a0ae98b53ff2d0c520a9c01d5801c8fb04d7d389",
  "batch_id": "batch_01",
  "batch_position": 1,
  "status": "DRAFT",
  "assignment_status": "UNASSIGNED",
  "annotator": "",
  "reviewer": "",
  "annotation_record_status": "NOT_STARTED",
  "annotation_record_path": null,
  "annotation_content_sha256": null,
  "evidence_count": 0,
  "candidate_evidence_count": 6,
  "candidate_packet_paths": [
    "../batches/batch_01/evidence_candidates/GHSA-53q9-r3pm-6pq6.json"
  ],
  "source_check_ids": [
    "database-GHSA-53q9-r3pm-6pq6",
    "maintainer-GHSA-53q9-r3pm-6pq6"
  ],
  "human_confirmations": {
    "annotator_read_sources": false,
    "reviewer_read_sources": false
  },
  "quality_gate": "AWAITING_HUMANS",
  "prepared_by": "AI_ASSISTANT",
  "prepared_at": "2026-10-11T08:42:32.891966+00:00",
  "history": [
    {
      "event": "TASK_CREATED_BY_AI",
      "actor": "AI_ASSISTANT",
      "at": "2026-10-11T08:42:32.891966+00:00",
      "note": "Question metadata copied verbatim; no answer, human identity, signature or approval generated."
    }
  ]
}
