{
  "schema_version": "aegisbench-annotation-task-v1",
  "record_kind": "ANNOTATION_TASK_NOT_GROUND_TRUTH",
  "id": "GHSA-53q9-r3pm-6pq6-risk-affected",
  "type": "ASSET_RISK",
  "additional_types": [],
  "category": "risk",
  "question": "按 benchmark-reference-triage-v1 评估此演示资产对 CVE-2025-32434 的风险与优先级。",
  "input_context": {
    "asset": {
      "component": "torch",
      "id": "demo-GHSA-53q9-r3pm-6pq6-affected",
      "scenario": "CONTROLLED_NOT_PRODUCTION",
      "version": "2.5.1"
    },
    "component": "torch",
    "ecosystem": "PyPI",
    "target": "CVE-2025-32434",
    "triage_policy": "benchmark-reference-triage-v1"
  },
  "origin": "CONTROLLED_SCENARIO",
  "source_ids": [
    "GHSA-53q9-r3pm-6pq6"
  ],
  "dataset_version": "AegisBench-v0.2.1-pilot",
  "dataset_questions_sha256": "f1f4be86e202ec263c6ebac66782b74d265840d706b559d913ab0c8c5f45e6f1",
  "question_sha256": "0fcb4946ca866f095369e20f36a6b8b422ce8058272bd8ac2828946004e81211",
  "batch_id": "batch_02",
  "batch_position": 16,
  "status": "DRAFT",
  "assignment_status": "UNASSIGNED",
  "annotator": "",
  "reviewer": "",
  "annotation_record_status": "NOT_STARTED",
  "annotation_record_path": null,
  "annotation_content_sha256": null,
  "evidence_count": 0,
  "candidate_evidence_count": 0,
  "candidate_packet_paths": [],
  "source_check_ids": [],
  "human_confirmations": {
    "annotator_read_sources": false,
    "reviewer_read_sources": false
  },
  "quality_gate": "AWAITING_HUMANS",
  "prepared_by": "AI_ASSISTANT",
  "prepared_at": "2026-10-11T08:42:32.891966+00:00",
  "history": [
    {
      "event": "TASK_CREATED_BY_AI",
      "actor": "AI_ASSISTANT",
      "at": "2026-10-11T08:42:32.891966+00:00",
      "note": "Question metadata copied verbatim; no answer, human identity, signature or approval generated."
    }
  ]
}
