{
  "schema_version": "aegisbench-annotation-task-v1",
  "record_kind": "ANNOTATION_TASK_NOT_GROUND_TRUTH",
  "id": "GHSA-47fc-vmwq-366v-release-and-poc",
  "type": "POC_VERIFICATION",
  "additional_types": [
    "PATCH_ANALYSIS"
  ],
  "category": "poc_patch",
  "question": "按公告的修复版本记录判断 CVE-2022-45907 的 release fix；公开 PoC 是否经过独立验证？",
  "input_context": {
    "component": "torch",
    "ecosystem": "PyPI",
    "target": "CVE-2022-45907"
  },
  "origin": "REAL_SOURCE",
  "source_ids": [
    "GHSA-47fc-vmwq-366v"
  ],
  "dataset_version": "AegisBench-v0.2.1-pilot",
  "dataset_questions_sha256": "f1f4be86e202ec263c6ebac66782b74d265840d706b559d913ab0c8c5f45e6f1",
  "question_sha256": "bc1de99228c3158a918c2afb58a7996c28d1531e7dabbb53b3e1fd3ea66d4d30",
  "batch_id": "batch_02",
  "batch_position": 15,
  "status": "DRAFT",
  "assignment_status": "UNASSIGNED",
  "annotator": "",
  "reviewer": "",
  "annotation_record_status": "NOT_STARTED",
  "annotation_record_path": null,
  "annotation_content_sha256": null,
  "evidence_count": 0,
  "candidate_evidence_count": 0,
  "candidate_packet_paths": [],
  "source_check_ids": [],
  "human_confirmations": {
    "annotator_read_sources": false,
    "reviewer_read_sources": false
  },
  "quality_gate": "AWAITING_HUMANS",
  "prepared_by": "AI_ASSISTANT",
  "prepared_at": "2026-10-11T08:42:32.891966+00:00",
  "history": [
    {
      "event": "TASK_CREATED_BY_AI",
      "actor": "AI_ASSISTANT",
      "at": "2026-10-11T08:42:32.891966+00:00",
      "note": "Question metadata copied verbatim; no answer, human identity, signature or approval generated."
    }
  ]
}
