{
  "schema_version": "aegisbench-annotation-task-v1",
  "record_kind": "ANNOTATION_TASK_NOT_GROUND_TRUTH",
  "id": "GHSA-935w-9g4m-p28p-commit-candidate",
  "type": "PATCH_ANALYSIS",
  "additional_types": [],
  "category": "poc_patch",
  "question": "此链接仅出现在 CVE-2026-105752 的参考文献列表。没有代码验证记录时，能否认定为已验证补丁？",
  "input_context": {
    "candidate_kind": "patch",
    "candidate_reference": "https://github.com/vllm-project/vllm/commit/6a2a2bb02b563b83f946012959fd3927984d072a",
    "component": "vllm",
    "ecosystem": "PyPI",
    "target": "CVE-2026-105752"
  },
  "origin": "REAL_SOURCE",
  "source_ids": [
    "GHSA-935w-9g4m-p28p"
  ],
  "dataset_version": "AegisBench-v0.2.1-pilot",
  "dataset_questions_sha256": "f1f4be86e202ec263c6ebac66782b74d265840d706b559d913ab0c8c5f45e6f1",
  "question_sha256": "9af79cf5e05627acb976725010f8b93f93dda143f276e5367deeca412ca0484b",
  "batch_id": "batch_03",
  "batch_position": 15,
  "status": "DRAFT",
  "assignment_status": "UNASSIGNED",
  "annotator": "",
  "reviewer": "",
  "annotation_record_status": "NOT_STARTED",
  "annotation_record_path": null,
  "annotation_content_sha256": null,
  "evidence_count": 0,
  "candidate_evidence_count": 0,
  "candidate_packet_paths": [],
  "source_check_ids": [],
  "human_confirmations": {
    "annotator_read_sources": false,
    "reviewer_read_sources": false
  },
  "quality_gate": "AWAITING_HUMANS",
  "prepared_by": "AI_ASSISTANT",
  "prepared_at": "2026-10-11T08:42:32.891966+00:00",
  "history": [
    {
      "event": "TASK_CREATED_BY_AI",
      "actor": "AI_ASSISTANT",
      "at": "2026-10-11T08:42:32.891966+00:00",
      "note": "Question metadata copied verbatim; no answer, human identity, signature or approval generated."
    }
  ]
}
